{
  "schema_version": "0.1.0",
  "capability_id": "cap_local_command_readonly_demo",
  "issuer": {
    "actor_id": "user_mdheller",
    "actor_type": "user"
  },
  "subject": {
    "actor_id": "agent_workspace_operator",
    "actor_type": "agent",
    "role_id": "workspace_operator_readonly"
  },
  "resource": {
    "resource_id": "workspace_root_demo",
    "resource_type": "workspace_root",
    "scope": "readonly_diagnostics"
  },
  "verbs": [
    "inspect",
    "summarize",
    "export_diagnostics"
  ],
  "purpose": "Collect read-only diagnostics for a governed workspace operation.",
  "policy_basis": {
    "policy_ids": [
      "policy_workspace_readonly_diagnostics_v0"
    ],
    "policy_version": "0.1.0",
    "decision_id": "decision_allow_readonly_diagnostics_demo"
  },
  "evidence_basis": {
    "evidence_ids": [
      "evidence_workspace_operation_request_demo"
    ],
    "claim_ids": [
      "CLM-0004"
    ],
    "source_ids": [
      "SRC-0006"
    ]
  },
  "valid_from": "2026-06-04T00:00:00Z",
  "expires_at": "2026-06-05T00:00:00Z",
  "authority_band": "execute_local",
  "workspace_operation_binding": {
    "required": true,
    "operation_id": "op_readonly_diagnostics_demo",
    "operation_type": "diagnostic_export"
  },
  "receipt_requirements": {
    "emit_action_receipt": true,
    "emit_policy_receipt": true,
    "telemetry_plane": "developer_diagnostics",
    "retention_class": "short_lived_diagnostic"
  },
  "rollback": {
    "required": false,
    "strategy": "no_mutation_readonly_operation",
    "compensation_operation_type": "none"
  },
  "fail_closed": true
}
